{
	"$schema": "https://json-schema.org/draft/2020-12/schema",
	"$id": "https://github.com/Eiluviann/gentbox/docs/schema/message-v1.json",
	"title": "Gentbox message v1",
	"description": "What a sender POSTs to /v1/messages. Field names are camelCase. Unknown top-level fields are rejected so a typo never passes silently; `metadata` is the open extension point. Each message carries three independent fields, `type`, `urgent` and `blocking` (docs/adr/0007-message-type-urgency-blocking.md); any of them may be left to the rules. See docs/architecture.md.",
	"type": "object",
	"additionalProperties": false,
	"required": ["version", "source", "conversation", "title"],
	"properties": {
		"version": {
			"description": "Schema major version. The hub rejects any other value with 422.",
			"const": 1
		},
		"idempotencyKey": {
			"description": "Sender-chosen key that makes retries safe: a second POST with the same key from the same source.agent returns the stored message instead of creating another. Not the message id: the hub assigns that (a ULID) and returns it.",
			"$ref": "#/$defs/token"
		},
		"source": {
			"$ref": "#/$defs/source"
		},
		"conversation": {
			"$ref": "#/$defs/conversation"
		},
		"type": {
			"description": "What the message asks of you. `decision_required`: the agent needs your answer (approve or deny, pick a choice, reply). `action_required`: you must do something yourself outside the conversation (sign in, add a key, review a pull request), then tell the agent it is done. `task_completed`: work finished. `generic`: everything else, kept for reference. Declared fields win over the rules (except a user rule with `override = true`); missing ones are filled by user rules, then built-in rules, then the default `generic`.",
			"$ref": "#/$defs/messageType"
		},
		"urgent": {
			"description": "True when the message should reach you now: Time Sensitive on the Mac and the phone, breaks through quiet hours and Focus, title prefixed with \"URGENT:\". Default false. Never true for `generic`.",
			"type": "boolean"
		},
		"blocking": {
			"description": "What the agent does meanwhile. `non_blocking`: it keeps working and has planned for the answer to come later. `deferrable`: it has paused, but you may answer Defer to let it continue with work that needs no input. `blocking`: work cannot continue until you decide. Default `non_blocking`; always `non_blocking` for `task_completed` and `generic`.",
			"$ref": "#/$defs/blockingLevel"
		},
		"event": {
			"description": "The sender's own event name, dotted, for rules to match (e.g. `claude-code.notification.idle_prompt`). Never shown to the user.",
			"type": "string",
			"pattern": "^[a-z0-9][a-z0-9_.-]{0,127}$"
		},
		"title": {
			"description": "One line shown in every channel. Plain text.",
			"type": "string",
			"minLength": 1,
			"maxLength": 120
		},
		"summary": {
			"description": "Plain text: what is needed, or what was done. The description of every notification, on the Mac and on the phone (unless the phone payload mode is minimal or the message is sensitive), and the inbox row.",
			"type": "string",
			"maxLength": 400
		},
		"body": {
			"description": "Markdown shown in the conversation detail and the rich popup. In the `summary` payload mode an excerpt trimmed to the 4 KB push budget goes to the own iOS app over APNs (ADR 0006); never to the ntfy fallback.",
			"type": "string",
			"maxLength": 65536
		},
		"actions": {
			"description": "Buttons, in display order. The phone gets at most three, and answer buttons only when its payload mode shows what is asked (docs/architecture.md §9.3).",
			"type": "array",
			"maxItems": 6,
			"items": {
				"$ref": "#/$defs/action"
			}
		},
		"scope": {
			"description": "For `task_completed`: `task` (default) for one finished task, `goal` when the agent reached its overall objective. Picks the notification title (Task complete / Goal complete).",
			"type": "string",
			"enum": ["task", "goal"]
		},
		"awaitsResponse": {
			"description": "True when the sender intends to long-poll /v1/messages/{id}/response. What counts is the live waiter (a poll in flight or ended under 10 s ago): answer buttons (approve, deny, choice, reply, done, defer) are offered only while one exists.",
			"type": "boolean",
			"default": false
		},
		"correlationKey": {
			"description": "The slot this message occupies in its conversation. A new message with the key of an open message takes its slot in place (same notification, updated content) instead of pinging again, unless the open one has a live waiter and the new one has not; then it only counts as a repeat (docs/architecture.md §7).",
			"$ref": "#/$defs/token"
		},
		"rescinds": {
			"description": "Withdraws other open messages of the same conversation by correlation key, as part of sending this one. The same as POST /v1/conversations/{agent}/{id}/rescind.",
			"$ref": "#/$defs/rescindRequest"
		},
		"sensitive": {
			"description": "True when even the title must not leave the Mac. The phone then gets only the title phrase for the type, whatever the payload mode.",
			"type": "boolean",
			"default": false
		},
		"createdAt": {
			"description": "When the sender produced the event. The hub records its own receivedAt and orders by that.",
			"type": "string",
			"format": "date-time"
		},
		"expiresAt": {
			"description": "After this instant the message moves to `expired`, its popup closes and a waiting sender gets status `expired`. Defaults by type and blocking level (docs/architecture.md §5.2).",
			"type": "string",
			"format": "date-time"
		},
		"metadata": {
			"description": "Flat sender facts for rules and display (tool name, model, exit code). No secrets: metadata is stored and may be shown.",
			"type": "object",
			"maxProperties": 32,
			"propertyNames": {
				"pattern": "^[A-Za-z][A-Za-z0-9_]{0,63}$"
			},
			"additionalProperties": {
				"type": ["string", "number", "boolean"],
				"maxLength": 1024
			}
		}
	},
	"$defs": {
		"token": {
			"type": "string",
			"pattern": "^[A-Za-z0-9][A-Za-z0-9._:-]{0,127}$"
		},
		"messageType": {
			"type": "string",
			"enum": [
				"decision_required",
				"action_required",
				"task_completed",
				"generic"
			]
		},
		"blockingLevel": {
			"type": "string",
			"enum": ["non_blocking", "deferrable", "blocking"]
		},
		"rescindReason": {
			"description": "`resolved_elsewhere`: answered or handled in the session or another channel. `obsolete`: no longer needed. `superseded`: replaced by a newer message.",
			"type": "string",
			"enum": ["resolved_elsewhere", "obsolete", "superseded"]
		},
		"rescindRequest": {
			"description": "Body of DELETE /v1/messages/{id} (reason only) and of POST /v1/conversations/{agent}/{id}/rescind (reason and correlation keys); also the `rescinds` field of a message.",
			"type": "object",
			"additionalProperties": false,
			"required": ["reason"],
			"properties": {
				"reason": {
					"$ref": "#/$defs/rescindReason"
				},
				"correlationKeys": {
					"type": "array",
					"minItems": 1,
					"maxItems": 32,
					"items": {
						"$ref": "#/$defs/token"
					}
				}
			}
		},
		"source": {
			"description": "Who sent it.",
			"type": "object",
			"additionalProperties": false,
			"required": ["agent"],
			"properties": {
				"agent": {
					"description": "Stable agent id, lowercase (e.g. `claude-code`, `codex`). Rules and per-source settings key on it.",
					"type": "string",
					"pattern": "^[a-z0-9][a-z0-9-]{0,63}$"
				},
				"displayName": {
					"type": "string",
					"maxLength": 64
				},
				"version": {
					"type": "string",
					"maxLength": 64
				},
				"host": {
					"description": "Machine name, when the sender runs on another machine than the hub.",
					"type": "string",
					"maxLength": 255
				}
			}
		},
		"conversation": {
			"description": "The agent session the message belongs to. Coalescing, supersede and resolve all work within one conversation.",
			"type": "object",
			"additionalProperties": false,
			"required": ["id"],
			"properties": {
				"id": {
					"description": "The agent's session id (Claude Code `session_id`). Unique per source.agent.",
					"$ref": "#/$defs/token"
				},
				"title": {
					"type": "string",
					"maxLength": 120
				},
				"cwd": {
					"description": "Working directory. Shown as the project name; never sent to the phone.",
					"type": "string",
					"maxLength": 4096
				},
				"focus": {
					"$ref": "#/$defs/focusTarget"
				}
			}
		},
		"focusTarget": {
			"description": "How the `open` action brings the conversation forward. The hub tries `url`, then `terminal`, then activates `bundleId`.",
			"type": "object",
			"additionalProperties": false,
			"properties": {
				"url": {
					"description": "Deep link that opens the conversation (custom scheme or https). Only schemes on the user's allowlist are opened.",
					"type": "string",
					"format": "uri",
					"maxLength": 2048
				},
				"bundleId": {
					"description": "macOS bundle id of the app hosting the session (e.g. `com.mitchellh.ghostty`, `com.anthropic.claudefordesktop`).",
					"type": "string",
					"maxLength": 255
				},
				"terminal": {
					"type": "object",
					"additionalProperties": false,
					"properties": {
						"tty": {
							"type": "string",
							"pattern": "^/dev/[A-Za-z0-9/]+$"
						},
						"tmuxPane": {
							"type": "string",
							"pattern": "^%[0-9]+$"
						},
						"pid": {
							"type": "integer",
							"minimum": 1
						}
					}
				}
			}
		},
		"action": {
			"type": "object",
			"additionalProperties": false,
			"required": ["id", "label", "kind"],
			"properties": {
				"id": {
					"description": "Unique within the message; returned to the sender as `actionId`.",
					"type": "string",
					"pattern": "^[a-z0-9][a-z0-9_-]{0,31}$"
				},
				"label": {
					"type": "string",
					"minLength": 1,
					"maxLength": 40
				},
				"kind": {
					"$ref": "#/$defs/actionKind"
				},
				"value": {
					"description": "For `choice`: the value returned to the sender. For `snooze`: minutes as a decimal string (default 15).",
					"type": "string",
					"maxLength": 256
				},
				"placeholder": {
					"description": "For `reply`: the text field's placeholder.",
					"type": "string",
					"maxLength": 80
				},
				"destructive": {
					"description": "Shown in the destructive style and never offered as an ntfy one-tap button.",
					"type": "boolean",
					"default": false
				}
			},
			"allOf": [
				{
					"if": {
						"properties": {
							"kind": {
								"const": "choice"
							}
						}
					},
					"then": {
						"required": ["value"]
					}
				},
				{
					"if": {
						"properties": {
							"kind": {
								"const": "snooze"
							}
						}
					},
					"then": {
						"properties": {
							"value": {
								"pattern": "^[1-9][0-9]{0,3}$"
							}
						}
					}
				}
			]
		},
		"actionKind": {
			"description": "Answers, returned to the waiting sender: approve and deny (fixed meaning), choice (returns its value), reply (returns free text), done (you did the thing an `action_required` message asked for), defer (only on `deferrable` messages: keep working on what needs no input; the message stays open as `non_blocking` and the hub adds this button by itself). The first answer other than defer closes the message. Non-answers, never returned: open (acknowledges and brings the conversation forward) and snooze (a local to Gentbox reminder after `value` minutes; tells the agent nothing).",
			"type": "string",
			"enum": [
				"approve",
				"deny",
				"choice",
				"reply",
				"done",
				"defer",
				"open",
				"snooze"
			]
		},
		"actionResponse": {
			"description": "Body of GET /v1/messages/{id}/response. Not part of the POST body; defined here so senders validate both ends against one file.",
			"type": "object",
			"additionalProperties": false,
			"required": ["messageId", "status"],
			"properties": {
				"messageId": {
					"description": "The hub-assigned message id (ULID) from the 201 response.",
					"type": "string",
					"pattern": "^[0-9A-HJKMNP-TV-Z]{26}$"
				},
				"status": {
					"description": "`pending`: open, poll again. `answered`: see actionKind and value. `deferred`: you chose Defer; keep working on what needs no input and poll again later, the message stays open as `non_blocking`. `dismissed`: you marked it done without answering. `rescinded`: withdrawn (see rescindReason). `expired`. On `dismissed`, `rescinded` and `expired` the sender falls back to its own prompt.",
					"type": "string",
					"enum": [
						"pending",
						"answered",
						"deferred",
						"dismissed",
						"rescinded",
						"expired"
					]
				},
				"rescindReason": {
					"$ref": "#/$defs/rescindReason"
				},
				"actionId": {
					"type": "string"
				},
				"actionKind": {
					"description": "Only answer kinds are ever returned (defer as status `deferred`).",
					"type": "string",
					"enum": ["approve", "deny", "choice", "reply", "done"]
				},
				"value": {
					"description": "The choice value or the reply text.",
					"type": "string",
					"maxLength": 8192
				},
				"answeredVia": {
					"type": "string",
					"enum": ["mac", "phone", "watch", "cli"]
				},
				"answeredAt": {
					"type": "string",
					"format": "date-time"
				}
			}
		}
	},
	"allOf": [
		{
			"description": "`task_completed` and `generic` never block.",
			"if": {
				"required": ["type"],
				"properties": {
					"type": {
						"enum": ["task_completed", "generic"]
					}
				}
			},
			"then": {
				"properties": {
					"blocking": {
						"const": "non_blocking"
					}
				}
			}
		},
		{
			"description": "`generic` is never urgent.",
			"if": {
				"required": ["type"],
				"properties": {
					"type": {
						"const": "generic"
					}
				}
			},
			"then": {
				"properties": {
					"urgent": {
						"const": false
					}
				}
			}
		},
		{
			"description": "`scope` belongs to `task_completed`.",
			"if": {
				"required": ["scope", "type"]
			},
			"then": {
				"properties": {
					"type": {
						"const": "task_completed"
					}
				}
			}
		}
	]
}
