{
	"version": 1,
	"source": {
		"agent": "claude-code",
		"displayName": "Claude Code"
	},
	"conversation": {
		"id": "7f3a9c1e-5b2d-4e8a-9c61-2f0d8e4b7a10",
		"title": "Fix flaky ingest test"
	},
	"type": "generic",
	"event": "claude-code.subagent_stop",
	"title": "Subagent Explore finished",
	"correlationKey": "subagent-explore",
	"metadata": {
		"agentType": "Explore"
	}
}
