{
	"version": 1,
	"source": {
		"agent": "claude-code",
		"displayName": "Claude Code"
	},
	"conversation": {
		"id": "5d0c7a92-3e41-4b8f-a6d2-9f1e0b7c4a33",
		"title": "Publish the CLI package",
		"cwd": "/Users/me/Developer/gentbox"
	},
	"type": "action_required",
	"urgent": true,
	"blocking": "deferrable",
	"event": "mcp.ask",
	"title": "Sign in to npm so I can publish the CLI package",
	"summary": "Sign in to npm in a terminal, then tap Done. Defer if I should finish the changelog first",
	"body": "Run this in any terminal, then tap Done:\n\n```bash\nnpm login\n```\n\nPackage: `@gentbox/cli`",
	"actions": [
		{
			"id": "done",
			"label": "Done",
			"kind": "done"
		},
		{
			"id": "open",
			"label": "Open session",
			"kind": "open"
		}
	],
	"awaitsResponse": true,
	"correlationKey": "npm-login",
	"rescinds": {
		"correlationKeys": ["publish-plan"],
		"reason": "superseded"
	}
}
